username,message
dodgysddofficial,"hey Ryan, love your ""mentor of your mentor"" vibe—bold and badass. 

notice you're getting great engagement... would it help if we cloned you with AI to automate your DM's and pre-sell your audience into your program?"
thestrongtrader,"hey Tanner, love your process-oriented take on breaking bad trading habits.

would it help if we cloned you with AI to automate your DM's and pre-sell your audience into your program?"
theperceptivetrader,"hey sara, love how you tie discipline and emotional resilience to trading success—most people miss that connection. do you only coach traders 1:1 or do you offer group programs too?"
rodrigo.trader.coach,"yo rodrigo, man your track record with funded traders is unreal - 210 accounts unlocked this year?? are you running most of your coaching 1:1 or group-based?"
thestocksisterhood,"hey monga, love how you’re helping women build confidence while learning stocks—such an empowering mission. are your challenges live or on-demand?"
traderdivergent,"hey Alan, love your take on marrying mindset with tactics—most traders miss that.  

would it help if we cloned you with AI to automate your DM's and pre-sell your audience into your program?"
stuckinprofit,"hey Samuel, love your simple ""phone and wifi"" approach to financial stability.

would it help if we cloned you with AI to automate your DM's and pre-sell your audience into your program?"
compoundthemoney,"hey R.K., love your focus on making the stock market a predictable and passive income machine.  

would it help if we cloned you with AI to automate your DM's and pre-sell your audience into your program?"
keanutrades,"yo honeycomb, love how you simplify trading with edge + profitability for your audience. are your trading alerts live or pre-recorded?"
andrewshanejordan,"yo andrew, love how you simplify trading for all experience levels - that’s rare in this space. do you offer private coaching too?"
littlemiss300aday,"hey sumayyah, love how you’re making trading less intimidating for women – pray, profit, repeat is such a vibe. do you mainly focus on group programs or do you also do 1:1?"
roarlikerathore,"yo mahesh, love how you blend mindset and life alongside trading—most people miss that. is your 15min trading magic only in group settings or do you do 1:1 too?"
rayvaughnfx,"hey Rayvaughn, love your results-driven, million-dollar strategy vibe.  

would it help if we cloned you with AI to automate your DM's and pre-sell your audience into the BEST SMC Live Trade Room?"
steveteachescrypto,"hey Stephen, love your results-driven focus on helping traders multiply their profits.  

would it help if we cloned you with AI to automate your DM's and pre-sell your audience into your program?"
mamba_trades,"hey Daniel, love your focus on helping traders secure 7 figures in funding capital.

would it help if we cloned you with AI to automate your DM's and pre-sell your audience into your program?"
cmoorejr22,"hey CJ, love how you simplify day trading for brand-new and struggling traders—most people overcomplicate it.  

would it help if we cloned you with AI to automate your DMs and pre-sell your audience into your program?"
thebusytrader,"hey Heather, love your simple, no-fluff way of teaching stocks.

would it help if we cloned you with AI to automate your DM's and pre-sell your audience into your options course?"
stephencaincoaching,"hey #1, love your mission to help combat sport coaches and PTs create location freedom.

would it help if we cloned you with AI to automate your DM's and pre-sell your audience into your program?"
ryanbands_,"hey Ryan, love your grounded, God-fearing vibe—feels like you lead with values first.

would it help if we cloned you with AI to automate your DM's and pre-sell your audience into your program?"
dr.kevin_kaviyarasu,"hey Kevin, love how you’re creating millionaire earners who start with just RM3K-RM4K, insane results.

would it help if we cloned you with AI to automate your DM's and pre-sell your audience into your program?"
thetravel1ngtrader,"hey Traveling, love your mission of teaching 20,000+ traders to succeed.  

would it help if we cloned you with AI to automate your DM’s and pre-sell your audience into your program?"
colt_mosdef,"hey Colt, love your ""i’ll help you start trading futures"" mentality—super bold.

would it help if we cloned you with AI to automate your DM's and pre-sell your audience into your program?"
kennsilcott,"hey K, love your focus on helping competitors dominate and actually win shows. 

would it help if we cloned you with AI to automate your DM's and pre-sell your audience into your program?"
limitless_al,"hey Alek, love your laser-focused approach with the Limitless Entry Drill Strategy.

would it help if we cloned you with AI to automate your DM's and pre-sell your audience into your program?"
realdealzach,"yo zach, i love how you cut through the noise with no bs for traders. do you only do 1:1 coaching or group stuff too?"
joelthompsoncoach,"hey Joel, love your mission to help barbers retire while leveling up as online coaches. 

would it help if we cloned you with AI to automate your DM's and pre-sell your audience into your program?"
todd_allyn,"hey Todd, love your focus on helping pros optimize their purpose and success.

would it help if we cloned you with AI to automate your DM's and pre-sell your audience into your program?"
stockmarketwolf,"hey Andrew, love how you’ve built a $40M+ trading portfolio while teaching over 15K students worldwide.  

would it help if we cloned you with AI to automate your DM's and pre-sell your audience into your program?"
chartconfidence,"hey lakiesha, love how you simplify trading for new traders and actually show them how to scale profits—most people overcomplicate that. are you still taking on new clients?"
harshitaparwani_,"hey Harshita, love your dedication to helping others become financially independent. 

would it help if we cloned you with AI to automate your DM's and pre-sell your audience into your program?"
callme100k,"hey Kevin, love how you’re helping traders turn things around and actually win.  

would it help if we cloned you with AI to automate your DM's and pre-sell your audience into your program?"
pinterestexperts,"hey Emily, love how you help women turn their current skills into a VA biz—it’s so empowering.

would it help if we cloned you with AI to automate your DM's and pre-sell your audience into your program?"
drop.out.trader,"hey Bradley, love how you keep it real about fake accounts and stay focused on giving real value daily.

would it help if we cloned you with AI to automate your DMs and pre-sell your audience into your program?"
stoicmoneycoach,"hey Vittorio, love your commitment to helping beginner investors feel confident and chase financial freedom.  

would it help if we cloned you with AI to automate your DM's and pre-sell your audience into your program?"
the.investingcoach,"hey Oliver, love your simple, low-risk model for helping people make an extra $1k-$3k a month.

would it help if we cloned you with AI to automate your DM's and pre-sell your audience into your program?"
dahlia_wealth,"hey anjali, love how you focus on empowering women to become work-optional while keeping it approachable. curious, do you work with clients 1:1 or is it all through your programs?"
mswealthyofficial,"hey Simone, love your invisible wealth method idea—genius.

would it help if we cloned you with AI to automate your DMs and pre-sell your audience into your program?"
cody__yeh,"hey Cody, love your “set and done” strategy—super smart and time-savvy.

would it help if we cloned you with AI to automate your DM's and pre-sell your audience into your program?"
drmaazsadiq,"yo maaz, i love how you’ve tapped into such a niche with helping muslim dentists become work optional—super unique. are you still working 1:1 or mainly through your programs?"
calltoleap,"hey Steve, love your millionaire teacher vibe—making big moves while keeping it relatable.

would it help if we cloned you with AI to automate your DM's and pre-sell your audience into your program?"
shessomoneyhq,"hey anna, love how you’re all about turning businesses into wealth machines while stacking cash. do you still take on new clients or are you fully booked?"
delyannethemoneycoach,"hey Investing Coach, love your award-winning ""education, not advice"" approach.

would it help if we cloned you with AI to automate your DM's and pre-sell your audience into Slay the Stock Market®?"
briangrimes_247cfu,"hey Brian, love your ""built-for-you"" rental property approach.

would it help if we cloned you with AI to automate your DM's and pre-sell your audience into your program?"
makemillionswithmarilyn,"hey marilyn, love how you’re focused on creating generational wealth while helping others build passive income. are you still taking on new clients?"
misslillianhope,"hey lillian, love how you’re helping people face their money fears head-on and actually enjoy the process. are you doing 1:1 coaching or group too?"
ryankluke84,"hey Ryan, love your ""crack the UK property game"" vibe—feels like you really get the hustle.

would it help if we cloned you with AI to automate your DM’s and pre-sell your audience into your Airbnb program?"
betterwallet,"hey Marc, love your mission of helping 1st-gen investors build wealth—totally stands out.  

would it help if we cloned you with AI to automate your DM's and pre-sell your audience into your program?"
emmhaas,"hey Em, love your “me espresso” mentor vibe—so original and magnetic.  

would it help if we cloned you with AI to automate your DM's and pre-sell your audience into your program?"
arise.financial.coaching,"hey nicole, love how you’re flipping the script and empowering women to take control of their money. are you mainly working 1:1 or do you have group coaching too?"
lifecoachdeepti,"hey deepti, love how you’ve built a system that gets results in just 9 weeks—100+ success stories is no joke. do you offer 1:1 coaching too?"
smallstepfinance,"hey Small Step, love your simple yet powerful way of helping families hit millionaire status.

would it help if we cloned you with AI to automate your DM's and pre-sell your audience into Invest with Success Academy?"
therealcoachnina,"hey nina, love how you own your vibe and make permission-based sales feel so effortless. are you still taking 1:1 clients?"
financialcoachkidd,"hey Chris, love your mission to mentor people on financial literacy and entrepreneurship.

would it help if we cloned you with AI to automate your DM's and pre-sell your audience into your program?"
numberswithnina,"hey nina, love how transparent you are about crushing debt and building wealth for WOC. are your sales calls 1:1?"
rumena_hussain,"hey rumena, love how you blend faith and finance so effortlessly on your page. do you still take on 1:1 clients or just focus on your firm?"
moneycoach_meena,"hey meena, love how you’re helping women heal their relationship with money while making it feel effortless. do you mostly do group coaching or 1:1?"
coachtata_,"hey Kelvin, love your focus on helping sales pros get fit *and* increase their income.

would it help if we cloned you with AI to automate your DM's and pre-sell your audience into Knockfit University?"
felipemejiarei,"hey Felipe, love your ""helping investors hit financial freedom"" vibe—super dialed in.  

would it help if we cloned you with AI to automate your DM's and pre-sell your audience into your coaching program?"
charlloyd1,"yo charlie, love how you’re helping guys build that raw confidence to ditch the baggy shirts. are you doing strictly group coaching or offering 1:1 too?"
coachpatriciaivory,"hey Patricia, love how you’re breaking the stigma around menopause and making it something empowering.  

would it help if we cloned you with AI to automate your DM's and pre-sell your audience into your program?"
moneycoachvince,"hey Vince, love your ""money management before making money"" philosophy.

would it help if we cloned you with AI to automate your DM's and pre-sell your audience into your program?"
victoriahaydn,"hey Victoria, love your creative spin with the photography posing system—super unique.

would it help if we cloned you with AI to automate your DM's and pre-sell your audience into the photography posing system?"
wealthparatodos,"hey Rita, love your focus on helping BIPOC, women, & LGBTQ+ folks create work-optional lives through self-care.

would it help if we cloned you with AI to automate your DM's and pre-sell your audience into your program?"
thebudgetnista,"hey Tiffany, love how you’ve turned financial education into a movement with Get Good with Money.

would it help if we cloned you with AI to automate your DM's and pre-sell your audience into Live Richer Academy?"
bossladyt.w,"hey Taylor, love your non-traditional wealth-building vibe. 

would it help if we cloned you with AI to automate your DM's and pre-sell your audience into your program?"
paigeproperties,"hey paige, i love how you’re debunking the whole “1000 doors” myth - crazy relatable for investors. are your events all live or do you do virtual too?"
fitcoll_,"hey Colleen, love your focus on building strong bodies and even stronger minds.

would it help if we cloned you with AI to automate your DM's and pre-sell your audience into your program?"
traviswailehua,"yo travis, love how you’re zeroed in on building legacy for people in hawaii—powerful stuff man. do you only do workshops, or do you coach 1:1 too?"
ola_goldsmith,"hey Ola, love your focus on helping people increase their income while building a strong reputation.

would it help if we cloned you with AI to automate your DM's and pre-sell your audience into your program?"
caroline_savory,"hey Caroline, love your ""we make crypto trading simple"" vibe—straightforward and effective.  

would it help if we cloned you with AI to automate your DM's and pre-sell your audience into your program?"
alexdickcleland,"hey Alex, love your focus on building habits that actually stick for life.

would it help if we cloned you with AI to automate your DM's and pre-sell your audience into your program?"
jenniutz,"hey Jenni, love your coach-to-investor path—feels like you genuinely walk the talk. 

would it help if we cloned you with AI to automate your DM's and pre-sell your audience into your program?"
laura_ann_moore,"hey Laura, love your finance-by-day, DJ-by-night vibe—totally unique combo.

would it help if we cloned you with AI to automate your DM's and pre-sell your audience into your program?"
smillsap02,"hey Samuel, love your 'I am second' philosophy—seriously, respect.

would it help if we cloned you with AI to automate your DM's and pre-sell your audience into your program?"
journeytoinfluence,"hey sarah, 450k paid off in 18 months is wild - love how you’re helping others hit those big money goals too. are you still taking on new clients?"
building.gen.wealth,"hey Andrea, love how you’re creating space specifically for first gen WOC to take control of their money.

would it help if we cloned you with AI to automate your DM's and pre-sell your audience into your 1:1 Money Coaching Program?"
aditijain.co,"hey aditi, love how you’re flipping the script with reverse attraction marketing — so many people miss that side of the game. are you working with group programs or mainly 1:1?"
smitazara,"hey smita, i love how you’re breaking stereotypes with women in investing – that line about “who says stock market is only for men” is fire. do you offer 1:1 coaching?"
cassperr_smc_,"yo jesse, love how you’re helping traders get funded in such a short time. are you still taking on new clients?"
invest2give,"yo laquore, love how you’re making stock market investing feel doable for beginners. is the free starter kit automated, or do you guide people directly?"
thoroughbred.dan,"yo fast cash, love your focus on helping traders make instant wins online. are you only teaching through your courses or doing 1:1 too?"
edzfxtrade_,"yo, love how you’re helping traders pass funded accounts—catching my attention big time. do you still offer 1:1 coaching?"
moretotrading,"yo amadeus, love how you highlight accountability as the game-changer for traders’ results. are you working with people 1:1 or is it all through the system?"
im.iva.norris,"hey iva, love how you’ve mastered creative financing and built a reputation for teaching others to do the same. are you still taking on new investors to coach?"
rickytrades03,"yo ricardo, love how you’re helping traders scale with a clear system instead of all the usual fluff out there. are you mostly working with new traders or ones already established?"
kevinmatthewwilley,"yo kevo, love how you’re blending lacrosse, trading, and coaching into one powerhouse brand. are you doing 1:1s or group coaching right now?"
traderwieland,"hey wieland, love how you’re helping entrepreneurs step into day trading at such a big scale—20,000 students is nuts. are your coaching sessions 1:1 or group based?"
davidthomasoriginal,"hey david, love how you blend faith and leadership with trading—rare to see someone so grounded in this space. do you still take on new coaching clients?"
mahyerwhite,"yo mw, i like how you mix trading with motivation - makes the grind feel doable. are you still taking on new coaching clients?"